[
  { "dataset_id": "ds-hall-loop", "name": "Hall loop", "modality": "lidar+imu", "size_gb": 4.2, "license": "CC-BY-4.0", "path_digest": "sha256:0f1e2d3c4b5a69788796a5b4c3d2e1f00f1e2d3c4b5a69788796a5b4c3d2e1f0", "robot_id": "robot-hb1", "passes": 12, "tags": ["indoor", "slam", "open"], "captured_on": "2026-08-28", "logged_on": "2026-08-29" },
  { "dataset_id": "ds-stairwell", "name": "Stairwell", "modality": "lidar+imu+camera", "size_gb": 2.7, "license": "internal", "path_digest": "sha256:a1b2c3d4e5f60718293a4b5c6d7e8f90a1b2c3d4e5f60718293a4b5c6d7e8f90", "robot_id": "robot-hb2", "passes": 3, "tags": ["indoor", "stairs"], "captured_on": "2026-09-11", "logged_on": "2026-09-11" },
  { "dataset_id": "ds-bench-vib", "name": "Bench vibration sweep", "modality": "imu", "size_gb": 0.4, "license": "internal", "path_digest": "sha256:5e4d3c2b1a0f9e8d7c6b5a4938271605e4d3c2b1a0f9e8d7c6b5a49382716050", "robot_id": "lidar-rig", "passes": 40, "tags": ["vibration", "calibration"], "captured_on": "2026-09-04", "logged_on": "2026-09-04" },
  { "dataset_id": "ds-yard", "name": "Yard traverse", "modality": "lidar+gnss", "size_gb": 6.1, "license": "CC-BY-4.0", "path_digest": "sha256:9988776655443322110000112233445566778899aabbccddeeff001122334455", "robot_id": "robot-hb1", "passes": 6, "tags": ["outdoor", "slam", "open"], "captured_on": "2026-07-30", "logged_on": "2026-08-01" }
]
